{
  "$schema": "https://json-schema.org/draft/2020-12/schema",
  "$id": "https://bible-pal.local/meta.schema.json",
  "title": "Bible PAL traditional story meta",
  "description": "JSON Schema for per-story metadata files at assets/stories/traditional/{sid}/meta_{sid}.json. additionalProperties is false at every level to catch silent leak fields (e.g. the rVK incident: reflectionVoiceKey leaking into ~167 metas). New top-level fields require an intentional schema change.",
  "type": "object",
  "additionalProperties": false,
  "required": [
    "schemaVersion",
    "storyId",
    "mode",
    "kidFriendly",
    "languageStyle",
    "mood",
    "lengths",
    "createdByModel",
    "generationBatch",
    "title",
    "scriptureAnchor",
    "bibleStoryKey",
    "storyVoiceKey",
    "timelineEra",
    "primaryCharacterId",
    "primaryCharacterDisplayName",
    "files"
  ],
  "properties": {
    "schemaVersion": {
      "const": 2
    },
    "storyId": {
      "type": "integer",
      "minimum": 1
    },
    "mode": {
      "const": "traditional"
    },
    "kidFriendly": {
      "type": "boolean"
    },
    "languageStyle": {
      "type": "string",
      "enum": [
        "WEB",
        "KJV"
      ]
    },
    "lanes": {
      "type": "array",
      "items": {
        "type": "string",
        "enum": [
          "web",
          "kjv"
        ]
      },
      "uniqueItems": true,
      "minItems": 1
    },
    "mood": {
      "type": "string",
      "enum": [
        "encouraging",
        "calm_peaceful",
        "grateful",
        "brave_courage",
        "hurting",
        "anxious",
        "joyful",
        "weary"
      ]
    },
    "lengths": {
      "type": "array",
      "items": {
        "type": "string",
        "enum": [
          "short",
          "full",
          "long"
        ]
      },
      "uniqueItems": true,
      "minItems": 1
    },
    "createdByModel": {
      "type": "string",
      "minLength": 1
    },
    "generationBatch": {
      "type": "string",
      "minLength": 1
    },
    "title": {
      "type": "string",
      "minLength": 1
    },
    "scriptureAnchor": {
      "type": "string",
      "minLength": 1
    },
    "scriptureAnchorId": {
      "type": "string",
      "minLength": 1
    },
    "scriptureKeyVerse": {
      "type": "object",
      "description": "SPEC 12.1 kid-simple key verse: one central verse shown ungated before the parent gate.",
      "properties": {
        "ref": {
          "type": "string",
          "minLength": 1
        },
        "text": {
          "type": "string",
          "minLength": 1
        }
      },
      "required": [
        "ref",
        "text"
      ],
      "additionalProperties": false
    },
    "bibleStoryKey": {
      "type": "string",
      "minLength": 1
    },
    "bibleOrderIndex": {
      "type": "integer",
      "minimum": 0
    },
    "storyVoiceKey": {
      "type": "string",
      "description": "Narrator voice. Enum is the union of all values currently shipping in the corpus. Source of truth for *new* authoring is scripts/story_factory/story_voice_registry.py:APPROVED_NARRATOR_VOICES + the character voices documented in feedback_voice_rules.md. Banned-for-new voices (LILY_WOLFF, PETER_BOLD, MARCUS_ANCHOR, JOSEPH_DREAMER) and legacy retired voices (JOHN_DOE, CHRIS_DEFAULT) remain in this enum so existing metas validate; new authoring should still go through validate_story_voice().",
      "enum": [
        "VOICE_ARABELLA",
        "VOICE_ARCHER",
        "VOICE_BARNABAS_ENCOURAGER",
        "VOICE_BRADFORD",
        "VOICE_CHARLOTTE_V3",
        "VOICE_CHRIS_DEFAULT",
        "VOICE_DAVID_SHEPHERD",
        "VOICE_DEBORAH_WISE",
        "VOICE_ELIJAH_SAGE",
        "VOICE_ESTHER_BRAVE",
        "VOICE_HANNAH_HOPE",
        "VOICE_JAMES_BRITISH_PROFESSIONAL",
        "VOICE_JAMES_HUSKY",
        "VOICE_JANE_PROFESSIONAL",
        "VOICE_JOHN_BELOVED",
        "VOICE_JOHN_DOE",
        "VOICE_JOSEPH_DREAMER",
        "VOICE_LILY_WOLFF",
        "VOICE_MARCUS_ANCHOR",
        "VOICE_MARTHA_CARING",
        "VOICE_MARY_PONDER",
        "VOICE_MIRIAM_JOYFUL",
        "VOICE_NATASHA_AFRICAN_AMERICAN",
        "VOICE_NOAH_PATIENT",
        "VOICE_PETER_BOLD",
        "VOICE_PRISCILLA_TEACHER",
        "VOICE_REVEREND_MICHAEL_C_VINCENT",
        "VOICE_RUTH_COMFORT",
        "VOICE_SAMUEL_EARNEST",
        "VOICE_SARAH_STORYTELLER"
      ]
    },
    "voiceKey": {
      "type": "string",
      "description": "Legacy duplicate of storyVoiceKey (115 metas in the 1000-series cohort). Allowed but not required; new authoring uses storyVoiceKey only."
    },
    "timelineEra": {
      "type": "string",
      "enum": [
        "patriarchs",
        "exodus",
        "conquest",
        "judges",
        "kingdom",
        "exile",
        "return",
        "wisdom",
        "prophets",
        "jesus_ministry",
        "early_church"
      ]
    },
    "primaryCharacterId": {
      "type": "string",
      "minLength": 1
    },
    "primaryCharacterDisplayName": {
      "type": "string",
      "minLength": 1
    },
    "themeTags": {
      "type": "array",
      "items": {
        "type": "string",
        "minLength": 1
      }
    },
    "emotionalTags": {
      "type": "array",
      "items": {
        "type": "string",
        "minLength": 1
      }
    },
    "primaryLifeSituationTags": {
      "type": "array",
      "items": {
        "type": "string",
        "minLength": 1
      }
    },
    "secondaryLifeSituationTags": {
      "type": "array",
      "items": {
        "type": "string",
        "minLength": 1
      }
    },
    "ttsModel": {
      "type": "string",
      "description": "RENDER-CONFIG DOCTRINE: the audio-generation pipeline (scripts/generate_opus_audio.sh) is the single source of truth for what was actually sent to ElevenLabs. For stories rendered before 2026-06-14, ttsModel/ttsVoiceSettings in meta may not match the real render config and are NOT authoritative — do not bulk-reconcile the corpus. New stories should record the pipeline's actual settings at render time. Never assert meta == pipeline in tests/validators; it fails on legacy. (As of 2026-06-14 the pipeline hardcodes eleven_turbo_v2_5.)",
      "enum": [
        "eleven_v3",
        "eleven_multilingual_v2",
        "eleven_turbo_v2_5"
      ]
    },
    "ttsVoiceSettings": {
      "type": "object",
      "description": "See ttsModel description for the render-config doctrine: pipeline is authoritative; pre-2026-06-14 metas may drift; do not bulk-reconcile or test meta == pipeline.",
      "additionalProperties": false,
      "properties": {
        "stability": {
          "type": "number",
          "minimum": 0,
          "maximum": 1
        },
        "similarity_boost": {
          "type": "number",
          "minimum": 0,
          "maximum": 1
        },
        "style": {
          "type": "number",
          "minimum": 0,
          "maximum": 1
        },
        "use_speaker_boost": {
          "type": "boolean"
        },
        "speed": {
          "type": "number",
          "minimum": 0.5,
          "maximum": 2.0
        }
      }
    },
    "renderedAt": {
      "type": "string",
      "description": "UTC ISO-8601 timestamp of the last successful audio render, written by scripts/generate_opus_audio.sh after a story's render pass completes with at least one generated file and zero failures. Absent on stories rendered before this field was introduced (2026-06-14); not backfilled — see ttsModel render-config doctrine."
    },
    "generatorVersion": {
      "type": "string",
      "description": "Which generator wrote the render metadata (ttsModel/ttsVoiceSettings/renderedAt). Written only on successful real renders; never in --dry-run."
    },
    "shortScripture": {
      "type": "boolean"
    },
    "reflectionText": {
      "type": "string"
    },
    "reflectionForm": {
      "type": "string",
      "enum": [
        "standard",
        "observation",
        "image_cascade"
      ],
      "description": "Optional reflection form. Absent normalizes to 'standard' (valid 25-80 words, target 35-60). The 'observation' and 'image_cascade' forms permit 25-120 words and may only be used when the controller's immutable planning assignment assigns that form; a writer may not self-elevate. Existing stories authored before this contract are grandfathered and omit the field."
    },
    "reflectionQuestion": {
      "type": "string"
    },
    "reflectionSource": {
      "type": "string",
      "enum": [
        "llm",
        "claude-opus-4-7",
        "template"
      ]
    },
    "editorialFlag": {
      "type": "string",
      "enum": [
        "exceptional"
      ]
    },
    "editorialNotes": {
      "type": "string"
    },
    "source": {
      "type": "string",
      "description": "LEGACY (grandfathered, do not write in new generation). Provenance marker for the 800-series cohort produced by the retired STORY_FACTORY v2.3 pipeline. Observed only on storyIds 801-834."
    },
    "generationContractVersion": {
      "type": "string",
      "description": "LEGACY (grandfathered, do not write in new generation). Pipeline contract version string used by the retired STORY_FACTORY v2.3 cohort (storyIds 807-834)."
    },
    "voiceKeys": {
      "type": "object",
      "description": "LEGACY (grandfathered, do not write in new generation). Per-length voice override map from the STORY_FACTORY v2.3 cohort (storyIds 809-834). Superseded by the single canonical `storyVoiceKey` field.",
      "additionalProperties": {
        "type": "string"
      }
    },
    "boundaryValidation": {
      "type": "object",
      "description": "LEGACY (grandfathered, do not write in new generation). Per-length pass/fail marker from the STORY_FACTORY v2.3 pipeline (storyIds 827-834).",
      "additionalProperties": {
        "type": "string"
      }
    },
    "wordCountFlags": {
      "type": "object",
      "description": "LEGACY (grandfathered, do not write in new generation). Per-length word-count audit record from the STORY_FACTORY v2.3 pipeline (storyIds 826-834). Modern bucket gate is enforced by scripts/validate_corpus.py.",
      "additionalProperties": true
    },
    "skippedLengths": {
      "type": "object",
      "description": "LEGACY (grandfathered, do not write in new generation). Records intentionally-skipped lengths in STORY_FACTORY v2.3 (storyIds 827, 829). Modern flow: omit the length from `lengths` and don't add a `files.{length}` entry.",
      "additionalProperties": {
        "type": "string"
      }
    },
    "reflections": {
      "type": "object",
      "description": "LEGACY (grandfathered, do not write in new generation). Object form of reflection filenames keyed by lane (web/kjv), observed on storyIds 1016-1071. Superseded by `files.reflection.reflectionText` and `files.reflection_kjv.reflectionText`.",
      "additionalProperties": false,
      "properties": {
        "web": {
          "type": "string",
          "minLength": 1
        },
        "kjv": {
          "type": "string",
          "minLength": 1
        }
      }
    },
    "files": {
      "type": "object",
      "additionalProperties": false,
      "patternProperties": {
        "^(short|full|long)(_kjv)?$": {
          "type": "object",
          "additionalProperties": false,
          "properties": {
            "storyText": {
              "type": "string",
              "minLength": 1
            },
            "storyAudio": {
              "type": "string",
              "minLength": 1
            },
            "storyTextV3": {
              "type": "string",
              "minLength": 1,
              "description": "LEGACY (grandfathered, do not write in new generation). v3 TTS audio pilot variant, observed only on storyIds 1121 and 1122."
            },
            "reflectionText": {
              "type": "string",
              "minLength": 1,
              "description": "LEGACY (grandfathered, do not write in new generation). 801 anomaly: reflection content inlined under a length entry instead of under files.reflection."
            },
            "reflectionAudio": {
              "type": "string",
              "minLength": 1,
              "description": "LEGACY (grandfathered, do not write in new generation). 801 anomaly: see reflectionText description."
            }
          }
        },
        "^reflection(_kjv)?$": {
          "type": "object",
          "additionalProperties": false,
          "properties": {
            "reflectionText": {
              "type": "string",
              "minLength": 1
            },
            "reflectionAudio": {
              "type": "string",
              "minLength": 1
            }
          }
        }
      }
    },
    "sceneBeats": {
      "type": "array",
      "items": {
        "type": "string"
      },
      "description": "Multi-word story-beat identifiers (moved out of themeTags in the 2026-06 theme-tag migration)."
    },
    "editorialBucketException": {
      "type": "string",
      "description": "Documented reason this story is exempt from the strict word-count bucket gate (legacy_bucket_drift | lyric_expansion). Word-count remediation backlog."
    },
    "boundaryException": {
      "type": "string",
      "description": "Documented reason a story is exempt from the ADR-025 boundary-drift scan (scriptural = phrase is verbatim in the passage; deferred_boundary_drift = legacy, queued for editorial review)."
    }
  }
}
