{
  "schemaVersion": 2,
  "storyId": 1268,
  "mode": "traditional",
  "kidFriendly": false,
  "languageStyle": "WEB",
  "lanes": [
    "web",
    "kjv"
  ],
  "mood": "calm_peaceful",
  "lengths": [
    "short"
  ],
  "shortScripture": true,
  "createdByModel": "claude-opus-4-7",
  "generationBatch": "PAL_OPUS_BATCH_06_V3_PILOT",
  "title": "Don't Let Your Heart Be Troubled",
  "scriptureAnchor": "John 14:1-3, 18-19, 27",
  "scriptureAnchorId": "john_14_comfort_selected",
  "bibleStoryKey": "let_not_your_heart_be_troubled",
  "storyVoiceKey": "VOICE_HANNAH_HOPE",
  "themeTags": [
    "comfort",
    "presence",
    "promise",
    "peace"
  ],
  "emotionalTags": [
    "anxious",
    "afraid",
    "alone",
    "comforted",
    "trusting",
    "peaceful"
  ],
  "primaryCharacterId": "jesus",
  "primaryCharacterDisplayName": "Jesus",
  "bibleOrderIndex": 670,
  "timelineEra": "jesus_ministry",
  "ttsModel": "eleven_turbo_v2_5",
  "ttsVoiceSettings": {
    "stability": 0.85,
    "similarity_boost": 0.85,
    "style": 0.15,
    "use_speaker_boost": true
  },
  "files": {
    "short": {
      "storyText": "story_1268_traditional_web_short.txt"
    },
    "short_kjv": {
      "storyText": "story_1268_traditional_kjv_short.txt"
    },
    "reflection": {
      "reflectionText": "reflection_1268_traditional_web.txt"
    },
    "reflection_kjv": {
      "reflectionText": "reflection_1268_traditional_kjv.txt"
    }
  },
  "reflectionText": "Jesus said in the upper room: do not let your heart be troubled. In my Father's house are many homes. I will come again. Peace I leave with you. My peace I give to you. How does it land to be given a peace from the One who is about to be taken from your side?"
}
