{
  "schemaVersion": 2,
  "storyId": 1335,
  "mode": "traditional",
  "kidFriendly": false,
  "languageStyle": "WEB",
  "lanes": [
    "web",
    "kjv"
  ],
  "mood": "grateful",
  "lengths": [
    "short"
  ],
  "shortScripture": false,
  "createdByModel": "claude-opus-4-7",
  "generationBatch": "PAL_OPUS_BATCH_06_V3_PILOT",
  "title": "Oh the Depth of the Riches",
  "scriptureAnchor": "Romans 11:33-36",
  "scriptureAnchorId": "romans_11_33-36",
  "bibleStoryKey": "depths_of_riches_of_god",
  "storyVoiceKey": "VOICE_REVEREND_MICHAEL_C_VINCENT",
  "themeTags": [
    "doxology",
    "wisdom_of_god",
    "mystery",
    "thanksgiving",
    "sovereignty"
  ],
  "emotionalTags": [
    "grateful",
    "awed",
    "humbled",
    "reverent",
    "exalted",
    "wondering"
  ],
  "primaryCharacterId": "paul_apostle",
  "primaryCharacterDisplayName": "Paul",
  "bibleOrderIndex": 708,
  "timelineEra": "early_church",
  "ttsModel": "eleven_turbo_v2_5",
  "ttsVoiceSettings": {
    "stability": 0.85,
    "similarity_boost": 0.85,
    "style": 0.15,
    "use_speaker_boost": true
  },
  "files": {
    "short": {
      "storyText": "story_1335_traditional_web_short.txt"
    },
    "short_kjv": {
      "storyText": "story_1335_traditional_kjv_short.txt"
    },
    "reflection": {
      "reflectionText": "reflection_1335_traditional_web.txt"
    },
    "reflection_kjv": {
      "reflectionText": "reflection_1335_traditional_kjv.txt"
    }
  },
  "reflectionText": "Oh the depth of the riches both of the wisdom and the knowledge of God! How unsearchable are his judgments. What does it feel like to look at the whole long pattern of what God has done, is doing, and will yet do — and to find that no theology is wide enough to hold what rises in you then?"
}
