{
  "schemaVersion": 2,
  "storyId": 1174,
  "mode": "traditional",
  "kidFriendly": false,
  "languageStyle": "WEB",
  "lanes": [
    "web"
  ],
  "mood": "encouraging",
  "lengths": [
    "short"
  ],
  "createdByModel": "claude-opus-4-7",
  "generationBatch": "PAL_OPUS_BATCH_06_V3_PILOT",
  "title": "What Have I to Do with You",
  "scriptureAnchor": "Mark 5:1-20",
  "bibleStoryKey": "demoniac_at_gerasenes",
  "storyVoiceKey": "VOICE_BRADFORD",
  "themeTags": [
    "hope",
    "promise",
    "faith"
  ],
  "emotionalTags": [
    "hopeful",
    "encouraged",
    "renewed",
    "trusting",
    "inspired"
  ],
  "primaryCharacterId": "jesus",
  "primaryCharacterDisplayName": "Jesus",
  "bibleOrderIndex": 632,
  "timelineEra": "jesus_ministry",
  "ttsModel": "eleven_v3",
  "ttsVoiceSettings": {
    "stability": 0.85,
    "similarity_boost": 0.85,
    "style": 0.15,
    "use_speaker_boost": true,
    "speed": 0.95
  },
  "files": {
    "short": {
      "storyText": "story_1174_traditional_web_short.txt"
    }
  }
}
