{
  "schemaVersion": 2,
  "storyId": 1112,
  "mode": "traditional",
  "kidFriendly": false,
  "languageStyle": "WEB",
  "lanes": [
    "web",
    "kjv"
  ],
  "mood": "brave_courage",
  "lengths": [
    "short",
    "full",
    "long"
  ],
  "createdByModel": "claude-opus-4-6",
  "generationBatch": "PAL_OPUS_BATCH_06",
  "title": "David and Goliath",
  "scriptureAnchor": "1 Samuel 17:1-50",
  "bibleStoryKey": "david_and_goliath",
  "storyVoiceKey": "VOICE_JAMES_BRITISH_PROFESSIONAL",
  "themeTags": [
    "courage",
    "faith",
    "obedience",
    "deliverance"
  ],
  "primaryCharacterId": "david",
  "primaryCharacterDisplayName": "David",
  "bibleOrderIndex": 220,
  "timelineEra": "kingdom",
  "files": {
    "short": {
      "storyText": "story_1112_traditional_web_short.txt"
    },
    "full": {
      "storyText": "story_1112_traditional_web_full.txt"
    },
    "reflection": {
      "reflectionText": "reflection_1112_traditional_web.txt"
    },
    "long": {
      "storyText": "story_1112_traditional_web_long.txt"
    },
    "full_kjv": {
      "storyText": "story_1112_traditional_kjv_full.txt"
    },
    "long_kjv": {
      "storyText": "story_1112_traditional_kjv_long.txt"
    }
  },
  "emotionalTags": [
    "determined",
    "steadfast",
    "resolute",
    "brave",
    "afraid",
    "watchful"
  ]
}
