{
  "schemaVersion": 2,
  "storyId": 1471,
  "mode": "traditional",
  "kidFriendly": false,
  "languageStyle": "WEB",
  "lanes": [
    "web",
    "kjv"
  ],
  "mood": "weary",
  "lengths": [
    "short"
  ],
  "shortScripture": false,
  "createdByModel": "claude-opus-4-7",
  "generationBatch": "PAL_BATCH_18_V3_QUALITY_EXPERIMENT",
  "title": "How Long, O Yahweh",
  "scriptureAnchor": "Psalm 6:1-7",
  "scriptureAnchorId": "psalm_6_1-7",
  "bibleStoryKey": "davids_psalm_of_weariness",
  "storyVoiceKey": "VOICE_NOAH_PATIENT",
  "themeTags": [
    "how_long_o_yahweh",
    "bones_troubled_soul_anguished",
    "drench_the_couch_with_tears",
    "eye_wastes_with_grief",
    "psalm_for_the_sheminith"
  ],
  "emotionalTags": [
    "weary",
    "hurting",
    "pleading",
    "longing",
    "earnest",
    "trusting"
  ],
  "primaryCharacterId": "david",
  "primaryCharacterDisplayName": "David",
  "bibleOrderIndex": 480,
  "timelineEra": "wisdom",
  "ttsModel": "eleven_v3",
  "ttsVoiceSettings": {
    "stability": 0.85,
    "similarity_boost": 0.85,
    "style": 0.15,
    "use_speaker_boost": true,
    "speed": 0.95
  },
  "files": {
    "short": {
      "storyText": "story_1471_traditional_web_short.txt"
    },
    "short_kjv": {
      "storyText": "story_1471_traditional_kjv_short.txt"
    },
    "reflection": {
      "reflectionText": "reflection_1471_traditional_web.txt"
    }
  },
  "reflectionText": "David wrote a psalm for the nights when his bones felt sick. He gave it to the music director so the people would have words for nights like his. What is the gift of a prayer set down in advance for someone whose sleepless night has not yet come?"
}
