{
  "schemaVersion": 2,
  "storyId": 1534,
  "mode": "traditional",
  "kidFriendly": false,
  "lanes": [
    "web",
    "kjv"
  ],
  "mood": "hurting",
  "lengths": [
    "short",
    "full",
    "long"
  ],
  "voiceKey": "VOICE_JOHN_BELOVED",
  "createdByModel": "claude-opus-4-6",
  "generationBatch": "PAL_OPUS_BATCH_30_TEXTURE_ROTATION",
  "reflectionQuestion": "When you think about the widow preparing what she believed would be her last meal, is there a place in your own life where you've felt you were down to the very last of what you had to give \u2014 and what did it feel like to be asked for even that?",
  "title": "The Widow at Zarephath",
  "files": {
    "short": {
      "storyText": "story_1534_traditional_web_short.txt"
    },
    "full": {
      "storyText": "story_1534_traditional_web_full.txt"
    },
    "short_kjv": {
      "storyText": "story_1534_traditional_kjv_short.txt"
    },
    "full_kjv": {
      "storyText": "story_1534_traditional_kjv_full.txt"
    },
    "reflection": {
      "reflectionText": "reflection_1534_traditional_web.txt"
    },
    "reflection_kjv": {
      "reflectionText": "reflection_1534_traditional_kjv.txt"
    },
    "long": {
      "storyText": "story_1534_traditional_web_long.txt"
    },
    "long_kjv": {
      "storyText": "story_1534_traditional_kjv_long.txt"
    }
  },
  "reflectionSource": "llm",
  "storyVoiceKey": "VOICE_JOHN_BELOVED",
  "scriptureAnchor": "1 Kings 17:8-16",
  "bibleStoryKey": "elijah_and_widow_at_zarephath",
  "reflections": {
    "web": "reflection_1534_traditional_web.txt",
    "kjv": "reflection_1534_traditional_kjv.txt"
  },
  "timelineEra": "kingdom",
  "primaryCharacterId": "elijah",
  "primaryCharacterDisplayName": "Elijah",
  "languageStyle": "WEB",
  "scriptureAnchorId": "1_kings_17_8-16",
  "shortScripture": false,
  "reflectionText": "When you think about the widow preparing what she believed would be her last meal, is there a place in your own life where you've felt you were down to the very last of what you had to give \u2014 and what did it feel like to be asked for even that?",
  "ttsModel": "eleven_turbo_v2_5",
  "ttsVoiceSettings": {
    "stability": 0.6,
    "similarity_boost": 0.8,
    "style": 0.0,
    "use_speaker_boost": true
  },
  "bibleOrderIndex": 38326
}
