{
  "schemaVersion": 2,
  "storyId": 1279,
  "mode": "traditional",
  "kidFriendly": false,
  "languageStyle": "WEB",
  "lanes": [
    "web",
    "kjv"
  ],
  "mood": "encouraging",
  "lengths": [
    "short"
  ],
  "shortScripture": true,
  "createdByModel": "claude-opus-4-7",
  "generationBatch": "PAL_OPUS_BATCH_06_V3_PILOT",
  "title": "No Longer a Servant, but a Beloved Brother",
  "scriptureAnchor": "Philemon 1:8-16",
  "scriptureAnchorId": "philemon_1_8_16",
  "bibleStoryKey": "onesimus_received_as_brother",
  "storyVoiceKey": "VOICE_JOHN_BELOVED",
  "themeTags": [
    "forgiveness",
    "restoration",
    "love",
    "redemption"
  ],
  "emotionalTags": [
    "hopeful",
    "comforted",
    "loved",
    "humbled",
    "tender",
    "encouraged"
  ],
  "primaryCharacterId": "paul_apostle",
  "primaryCharacterDisplayName": "Paul",
  "bibleOrderIndex": 750,
  "timelineEra": "early_church",
  "ttsModel": "eleven_v3",
  "ttsVoiceSettings": {
    "stability": 0.85,
    "similarity_boost": 0.85,
    "style": 0.15,
    "use_speaker_boost": true,
    "speed": 0.95
  },
  "files": {
    "short": {
      "storyText": "story_1279_traditional_web_short.txt"
    },
    "short_kjv": {
      "storyText": "story_1279_traditional_kjv_short.txt"
    },
    "reflection": {
      "reflectionText": "reflection_1279_traditional_web.txt"
    },
    "reflection_kjv": {
      "reflectionText": "reflection_1279_traditional_kjv.txt"
    }
  },
  "reflectionText": "Paul wrote to Philemon: I beg you for my child Onesimus, whom I have become the father of in my chains. Receive him no longer as a bondservant, but more than a bondservant — a beloved brother. What is it to be asked to receive back the one who wronged you, no longer as anything less than a brother in the Lord?"
}
