{
  "schemaVersion": 2,
  "storyId": 1425,
  "mode": "traditional",
  "kidFriendly": false,
  "languageStyle": "WEB",
  "lanes": [
    "web",
    "kjv"
  ],
  "mood": "joyful",
  "lengths": [
    "short"
  ],
  "shortScripture": false,
  "createdByModel": "claude-opus-4-7",
  "generationBatch": "PAL_OPUS_BATCH_12_V3_IMMERSIVE",
  "title": "The Widow's Oil",
  "scriptureAnchor": "2 Kings 4:1-7",
  "scriptureAnchorId": "2_kings_4_1-7",
  "bibleStoryKey": "widows_oil_multiplied_by_elisha",
  "storyVoiceKey": "VOICE_CHARLOTTE_V3",
  "themeTags": [
    "widows_oil_multiplied",
    "jars_borrowed_from_neighbors",
    "shut_the_door_pour_the_oil",
    "creditor_threatening_to_take_sons",
    "debt_paid_from_the_one_pot"
  ],
  "emotionalTags": [
    "joyful",
    "marveling",
    "relieved",
    "communal",
    "tender",
    "settled"
  ],
  "primaryCharacterId": "widow_of_prophets_son",
  "primaryCharacterDisplayName": "Widow of the Prophet's Son",
  "bibleOrderIndex": 326,
  "timelineEra": "kingdom",
  "ttsModel": "eleven_v3",
  "ttsVoiceSettings": {
    "stability": 0.85,
    "similarity_boost": 0.85,
    "style": 0.15,
    "use_speaker_boost": true,
    "speed": 0.95
  },
  "files": {
    "short": {
      "storyText": "story_1425_traditional_web_short.txt"
    },
    "short_kjv": {
      "storyText": "story_1425_traditional_kjv_short.txt"
    },
    "reflection": {
      "reflectionText": "reflection_1425_traditional_web.txt"
    },
    "reflection_kjv": {
      "reflectionText": "reflection_1425_traditional_kjv.txt"
    }
  },
  "reflectionText": "The widow shut the door, and the oil flowed until every borrowed container was full. What is the shape of a provision that fills every vessel you have managed to gather, and does not stop until your hands have run out of vessels?"
}
