{
  "schemaVersion": 2,
  "storyId": 1584,
  "mode": "traditional",
  "kidFriendly": false,
  "languageStyle": "WEB",
  "lanes": [
    "web",
    "kjv"
  ],
  "mood": "encouraging",
  "lengths": [
    "short"
  ],
  "createdByModel": "claude-fable-5",
  "generationBatch": "PAL_DAILY_2026-07-24_BATCH_C",
  "title": "The Persistent Widow",
  "scriptureAnchor": "Luke 18:1-8",
  "scriptureAnchorId": "luke_18_1-8",
  "bibleStoryKey": "persistent_widow",
  "storyVoiceKey": "VOICE_RUTH_COMFORT",
  "shortScripture": false,
  "themeTags": [
    "prayer",
    "perseverance",
    "justice"
  ],
  "emotionalTags": [
    "encouraged",
    "resolute",
    "hopeful"
  ],
  "primaryCharacterId": "jesus",
  "primaryCharacterDisplayName": "Jesus",
  "timelineEra": "jesus_ministry",
  "files": {
    "short": {
      "storyText": "story_1584_traditional_web_short.txt"
    },
    "short_kjv": {
      "storyText": "story_1584_traditional_kjv_short.txt"
    },
    "reflection": {
      "reflectionText": "reflection_1584_traditional_web.txt"
    },
    "reflection_kjv": {
      "reflectionText": "reflection_1584_traditional_kjv.txt"
    }
  },
  "reflectionText": "She had no power over the judge, no friend to speak for her — only the same plea, brought again and again until he could not turn her away. Jesus set her beside God himself and asked the harder thing: not whether God will answer, but whether he will find you still asking.",
  "editorialNotes": "PAL Daily supervised production 2026-07-24, Batch C (gap CG18). Luke 18:1-8, the Persistent Widow, absent both lanes; distinct from 1539 (Luke 18:9-14, the Pharisee and tax collector). SHORT only. NOTE on shortScripture: per owner direction, shortScripture was NOT used (no committed owner approval for 1584); the WEB short was brought to the honest 300-word floor (WEB 300w, KJV 300w) by giving each stated beat its natural room per ADR-031 — the widow's continual coming (18:3,5) narrated as repetition, the judge's reasoning and the Lord's application (including 18:7 'he bears long with them' and 18:8 'avenge speedily') let to land — with no repeated propositions or invented scene/motive. The 146-word source sits far below 300; if the owner prefers a tighter telling, this is a per-use shortScripture candidate (cf. 1580). Ends on the Son of Man question (18:8). TEXT DRAFT — AWAITING ADAM AND CHATGPT REVIEW.",
  "bibleOrderIndex": 80113
}
