{
  "schemaVersion": 2,
  "storyId": 1180,
  "mode": "traditional",
  "kidFriendly": false,
  "languageStyle": "WEB",
  "lanes": [
    "web"
  ],
  "mood": "hurting",
  "lengths": [
    "short"
  ],
  "createdByModel": "claude-opus-4-7",
  "generationBatch": "PAL_OPUS_BATCH_06_V3_PILOT",
  "title": "He Went Away Sorrowful",
  "scriptureAnchor": "Mark 10:17-31",
  "bibleStoryKey": "rich_young_ruler",
  "storyVoiceKey": "VOICE_JOHN_BELOVED",
  "themeTags": [
    "suffering",
    "lament",
    "mercy"
  ],
  "emotionalTags": [
    "hurting",
    "grieving",
    "lonely",
    "broken",
    "alone"
  ],
  "primaryCharacterId": "jesus",
  "primaryCharacterDisplayName": "Jesus",
  "bibleOrderIndex": 660,
  "timelineEra": "jesus_ministry",
  "ttsModel": "eleven_v3",
  "ttsVoiceSettings": {
    "stability": 0.85,
    "similarity_boost": 0.85,
    "style": 0.15,
    "use_speaker_boost": true,
    "speed": 0.95
  },
  "files": {
    "short": {
      "storyText": "story_1180_traditional_web_short.txt"
    }
  }
}
