{
  "schemaVersion": 2,
  "storyId": 1181,
  "mode": "traditional",
  "kidFriendly": false,
  "languageStyle": "WEB",
  "lanes": [
    "web",
    "kjv"
  ],
  "mood": "joyful",
  "lengths": [
    "short",
    "full",
    "long"
  ],
  "createdByModel": "claude-opus-4-7",
  "generationBatch": "PAL_OPUS_BATCH_06_V3_PILOT",
  "title": "The Land Had Rest",
  "scriptureAnchor": "Judges 5:1-31",
  "bibleStoryKey": "song_of_deborah",
  "storyVoiceKey": "VOICE_DEBORAH_WISE",
  "themeTags": [
    "celebration",
    "praise",
    "gratitude",
    "rest"
  ],
  "emotionalTags": [
    "joyful",
    "thankful",
    "free",
    "grateful",
    "weary",
    "comforted"
  ],
  "primaryCharacterId": "deborah",
  "primaryCharacterDisplayName": "Deborah",
  "bibleOrderIndex": 156,
  "timelineEra": "judges",
  "ttsModel": "eleven_turbo_v2_5",
  "ttsVoiceSettings": {
    "stability": 0.85,
    "similarity_boost": 0.85,
    "style": 0.15,
    "use_speaker_boost": true
  },
  "files": {
    "short": {
      "storyText": "story_1181_traditional_web_short.txt"
    },
    "short_kjv": {
      "storyText": "story_1181_traditional_kjv_short.txt"
    },
    "full": {
      "storyText": "story_1181_traditional_web_full.txt"
    },
    "long": {
      "storyText": "story_1181_traditional_web_long.txt"
    },
    "full_kjv": {
      "storyText": "story_1181_traditional_kjv_full.txt"
    },
    "long_kjv": {
      "storyText": "story_1181_traditional_kjv_long.txt"
    },
    "reflection": {
      "reflectionText": "reflection_1181_traditional_web.txt"
    },
    "reflection_kjv": {
      "reflectionText": "reflection_1181_traditional_kjv.txt"
    }
  },
  "reflectionText": "Deborah and Barak sang on the day of the Lord's victory: let those who love the Lord be like the sun when it rises in its strength. The land had rest forty years. What is the joy of singing on the morning when the land has begun to rest for years that are not yet known?"
}
