{
  "schemaVersion": 2,
  "storyId": 1334,
  "mode": "traditional",
  "kidFriendly": false,
  "languageStyle": "WEB",
  "lanes": [
    "web",
    "kjv"
  ],
  "mood": "grateful",
  "lengths": [
    "short"
  ],
  "shortScripture": false,
  "createdByModel": "claude-opus-4-7",
  "generationBatch": "PAL_OPUS_BATCH_06_V3_PILOT",
  "title": "Blessed Be Yahweh",
  "scriptureAnchor": "Genesis 24:26-27",
  "scriptureAnchorId": "genesis_24_26-27",
  "bibleStoryKey": "abrahams_servant_blesses_yahweh",
  "storyVoiceKey": "VOICE_RUTH_COMFORT",
  "themeTags": [
    "providence",
    "answered_prayer",
    "loving_kindness",
    "journey",
    "blessing"
  ],
  "emotionalTags": [
    "grateful",
    "humbled",
    "amazed",
    "tender",
    "trusting",
    "settled"
  ],
  "primaryCharacterId": "abrahams_servant",
  "primaryCharacterDisplayName": "Abraham's Servant",
  "bibleOrderIndex": 40,
  "timelineEra": "patriarchs",
  "ttsModel": "eleven_v3",
  "ttsVoiceSettings": {
    "stability": 0.85,
    "similarity_boost": 0.85,
    "style": 0.15,
    "use_speaker_boost": true,
    "speed": 0.95
  },
  "files": {
    "short": {
      "storyText": "story_1334_traditional_web_short.txt"
    },
    "short_kjv": {
      "storyText": "story_1334_traditional_kjv_short.txt"
    }
  }
}
